{
  "period": {
    "start": "2019-01-01",
    "end": "2024-12-31"
  },
  "metrics": {
    "cumulative_return": 0.42,
    "cagr": 0.074,
    "volatility": 0.142,
    "max_drawdown": -0.286
  },
  "disclaimer_version": "v3",
  "extensions": {
    "rolling_returns": {
      "window_3y": [
        { "end_date": "2022-12-31", "value": 0.18 }
      ],
      "window_5y": [
        { "end_date": "2024-12-31", "value": 0.42 }
      ]
    },
    "rolling_volatility": {
      "window_3y": [
        { "end_date": "2022-12-31", "value": 0.12 }
      ]
    },
    "yearly_returns": [
      { "year": 2021, "value": 0.08 },
      { "year": 2022, "value": -0.04 }
    ],
    "contributions": [
      { "item_id": "A1", "item_name": "Asset A", "value": 0.03 }
    ],
    "drawdown_segments": [
      { "start": "2022-03-01", "end": "2022-10-01", "drawdown": -0.18 }
    ]
  }
}
